{
  "$schema": "../../schemas/key.schema.json",
  "case": "priya-natarajan",
  "written": "2026-10-30",
  "items": [
    {
      "id": "G1",
      "kind": "gap",
      "title": "Second Shingrix dose never given (dose 1 at a pharmacy)",
      "lookingFor": "the second Shingrix dose after the first one at Alder Street Pharmacy on 2025-11-08",
      "evidence": [
        {
          "cite": {
            "file": "alder-street-pharmacy-patient-record.xml",
            "line": 478
          },
          "says": "Alder Street Pharmacy immunization entry VX-251108-2, 2025-11-08",
          "date": "2025-11-08",
          "id": "VX-251108-2"
        },
        {
          "cite": {
            "file": "alder-street-pharmacy-patient-record.xml",
            "line": 492
          },
          "says": "the entry is Shingrix (CVX 187)",
          "code": "187",
          "name": "zoster vaccine recombinant"
        },
        {
          "cite": {
            "file": "fernhill-family-clinic-summary-4.xml",
            "line": 568
          },
          "says": "Fernhill's immunization list (the PCP) shows only the 2024-10-15 flu shot",
          "date": "2024-10-15",
          "quote": "Influenza vaccine"
        }
      ],
      "absent": ["a second CVX 187 dose in any source"],
      "links": [
        "recombinant zoster vaccine is two doses, 2 to 6 months apart, for adults 50 and older",
        "she is 57 and only one dose is recorded, so the series is unfinished"
      ],
      "found": "names Shingrix/shingles vaccine, that one dose is recorded (Nov 2025, pharmacy) and that the second is missing or due now",
      "wrong": [
        "saying the series must be restarted",
        "saying she is not eligible (she is 57)",
        "saying no zoster vaccine was ever given"
      ],
      "pod": "visible",
      "guideline": "ACIP: recombinant zoster vaccine, two doses 2-6 months apart, adults 50 and older",
      "find": [
        {
          "question": "pod/My immunizations",
          "where": ["codes/cvx/187"]
        }
      ]
    },
    {
      "id": "G2",
      "kind": "gap",
      "title": "Hydrochlorothiazide stopped at hospital discharge, still active at the clinic and the pharmacy",
      "lookingFor": "hydrochlorothiazide stopped by the hospital on 2026-03-05, yet active at Fernhill and refilled by the pharmacy after",
      "evidence": [
        {
          "cite": {
            "file": "kestrel-harbor-health-summary-5.xml",
            "line": 334
          },
          "says": "Kestrel Harbor medication MED-2611, status aborted, ended 2026-03-05",
          "date": "2026-03-05",
          "dateKind": "end",
          "id": "MED-2611"
        },
        {
          "cite": {
            "file": "kestrel-harbor-health-summary-5.xml",
            "line": 223
          },
          "says": "narrative: discontinued March 5, 2026 (hyponatremia)",
          "date": "2026-03-05",
          "quote": "Discontinued March 5, 2026 (hyponatremia)"
        },
        {
          "cite": {
            "file": "kestrel-harbor-health-summary-5.xml",
            "line": 1256
          },
          "says": "discharge instructions: stop hydrochlorothiazide",
          "quote": "STOP taking hydrochlorothiazide"
        },
        {
          "cite": {
            "file": "kestrel-harbor-health-summary-5.xml",
            "line": 703
          },
          "says": "admission sodium 123 (L)",
          "date": "2026-03-02",
          "id": "LAB-61202",
          "value": "123"
        },
        {
          "cite": {
            "file": "kestrel-harbor-health-summary-5.xml",
            "line": 524
          },
          "says": "problem Hyponatremia, resolved",
          "value": "Hyponatremia"
        },
        {
          "cite": {
            "file": "kestrel-harbor-health-summary-5.xml",
            "line": 1241
          },
          "says": "encounter diagnosis: hyponatremia, likely due to hydrochlorothiazide",
          "value": "likely due to hydrochlorothiazide"
        },
        {
          "cite": {
            "file": "fernhill-family-clinic-summary-4.xml",
            "line": 234
          },
          "says": "Fernhill still lists it active (fm-7)",
          "date": "2025-12-09",
          "name": "hydrochlorothiazide",
          "id": "fm-7"
        },
        {
          "cite": {
            "file": "fernhill-family-clinic-summary-4.xml",
            "line": 1260
          },
          "says": "the 2026-06-15 note continues current medications, HCTZ included",
          "date": "2026-06-15",
          "quote": "Continue current medications"
        },
        {
          "cite": {
            "file": "fernhill-family-clinic-summary-4.xml",
            "line": 619
          },
          "says": "sodium 134 (L) on 2026-06-15",
          "date": "2026-06-15",
          "value": "134"
        },
        {
          "cite": {
            "file": "alder-street-pharmacy-patient-record.xml",
            "line": 218
          },
          "says": "pharmacy: active, last filled 2026-04-02 (90 days), after the stop",
          "date": "2026-04-02",
          "value": "90 days"
        },
        {
          "cite": {
            "file": "alder-street-pharmacy-patient-record.xml",
            "line": 218
          },
          "says": "pharmacy: active, last filled 2026-04-02 (90 days), after the stop",
          "value": "2 refills remaining"
        },
        {
          "cite": {
            "file": "alder-street-pharmacy-patient-record.xml",
            "line": 358
          },
          "says": "pharmacy prescription RX6131090",
          "id": "RX6131090"
        },
        {
          "cite": {
            "file": "clearwater-eye-associates-visit-summary.xml",
            "line": 204
          },
          "says": "Clearwater's patient-reported list, 2026-05-14, has it",
          "date": "2026-05-14",
          "value": "hydrochlorothiazide"
        }
      ],
      "links": [
        "a medicine one source stopped for a side effect and three others still show active means the lists were never reconciled",
        "thiazide diuretics cause low sodium, and her sodium was 123 then 134 (low) after the stop",
        "the pharmacy refilled it after the stop, so she may still be taking it"
      ],
      "found": "names HCTZ (or the water pill), that the hospital stopped it in March 2026, and that a later list still shows it active; the reason and the April refill are optional",
      "wrong": [
        "advising her to keep taking it without noting the hospital's stop",
        "saying she stopped it and nothing is outstanding"
      ],
      "pod": "deeper",
      "guideline": "medication reconciliation at care transitions (PSNet): a discontinued drug still active elsewhere",
      "find": [
        {
          "question": "pod/My active medications",
          "where": ["199903"]
        }
      ]
    },
    {
      "id": "G3",
      "kind": "gap",
      "title": "Urine albumin-to-creatinine ratio never done, eGFR done five times",
      "lookingFor": "the missing urine albumin test (uACR) for her diabetes and hypertension",
      "evidence": [
        {
          "cite": {
            "file": "fernhill-family-clinic-summary-3.xml",
            "line": 549
          },
          "says": "type 2 diabetes from 2025-09-22; she also has hypertension, on losartan",
          "date": "2025-09-22",
          "value": "44054006"
        },
        {
          "cite": {
            "file": "fernhill-family-clinic-summary-3.xml",
            "line": 762
          },
          "says": "eGFR 75 at Fernhill (Northbay carries a copy)",
          "date": "2025-09-22",
          "value": "75"
        },
        {
          "cite": {
            "file": "saltmarsh-regional-medical-center-ed-summary.xml",
            "line": 769
          },
          "says": "eGFR 63 at the Saltmarsh ED",
          "date": "2025-10-18",
          "value": "63"
        },
        {
          "cite": {
            "file": "kestrel-harbor-health-summary-5.xml",
            "line": 795
          },
          "says": "eGFR 62 at Kestrel Harbor, admission",
          "date": "2026-03-02",
          "value": "62"
        },
        {
          "cite": {
            "file": "kestrel-harbor-health-summary-5.xml",
            "line": 1040
          },
          "says": "eGFR 70 at Kestrel Harbor, discharge",
          "date": "2026-03-05",
          "value": "70"
        },
        {
          "cite": {
            "file": "fernhill-family-clinic-summary-4.xml",
            "line": 1068
          },
          "says": "eGFR 71 at Fernhill",
          "date": "2026-06-15",
          "value": "71"
        },
        {
          "cite": {
            "file": "saltmarsh-regional-medical-center-ed-summary.xml",
            "line": 584
          },
          "says": "the ED's urine dipstick protein, Negative: a test strip, not a uACR",
          "date": "2025-10-18",
          "id": "SRM-L-102",
          "code": "5804-0"
        }
      ],
      "absent": [
        "any urine albumin result (LOINC 9318-7, 14959-1, 32294-1) in any download"
      ],
      "links": [
        "type 2 diabetes calls for a uACR at diagnosis and yearly",
        "her eGFR was checked five times from three places, so kidney screening is half done",
        "a urine dipstick protein is not a uACR"
      ],
      "found": "names the urine albumin / albumin-creatinine / microalbumin test and that it is missing, with diabetes (or diabetes plus hypertension) as the reason",
      "wrong": [
        "saying it was done (citing the dipstick)",
        "saying her kidneys need nothing because eGFR is normal"
      ],
      "pod": "visible",
      "guideline": "ADA Standards of Care: uACR at diagnosis and at least yearly",
      "find": [
        {
          "question": "pod/My lab results",
          "where": ["98979-8"]
        },
        {
          "question": "pod/My active conditions",